{
  "member": {
    "member_state": "member_state",
    "member_city": "member_city",
    "name": "name",
    "member_country": "member_country",
    "member_id": 100
  },
  "id": 100,
  "member_photo": {
    "photo_link": "photo_link",
    "highres_link": "highres_link",
    "thumb_link": "thumb_link",
    "photo_id": 100
  },
  "udf_{varname}": "udf_{varname}",
  "created": 100,
  "event_id": 100
}
